{
  "schemaVersion": "1.0",
  "profile": "ui-regression-v1",
  "asOf": "2026-09-30T12:00:00Z",
  "maxEvidenceAgeSeconds": 3600,
  "cases": [
    {
      "id": "mobile-390",
      "producer": "synthetic-fixture",
      "observedAt": "2026-09-30T11:59:00Z",
      "required": [
        "overflow",
        "overlap",
        "focus",
        "back"
      ],
      "viewport": {
        "width": 390,
        "height": 844
      },
      "document": {
        "scrollWidth": 390
      },
      "rectangles": [
        {
          "id": "save",
          "x": 16,
          "y": 700,
          "width": 170,
          "height": 44,
          "visible": true
        },
        {
          "id": "cancel",
          "x": 204,
          "y": 700,
          "width": 170,
          "height": 44,
          "visible": true
        }
      ],
      "pairs": [
        {
          "id": "footer-buttons",
          "first": "save",
          "second": "cancel",
          "allowOverlap": false
        }
      ],
      "focus": {
        "expected": [
          "save",
          "cancel"
        ],
        "observed": [
          "save",
          "cancel"
        ],
        "complete": true
      },
      "back": {
        "expectedRouteId": "list",
        "observedRouteId": "list",
        "outcome": "settled",
        "complete": true
      }
    }
  ]
}
